{
  "version": "kb-package-2",
  "package": {
    "sourceId": "import-example",
    "title": "导入示例知识包",
    "namespace": "example.interview",
    "description": "kb-package-2 最小可用示例。",
    "createdAt": "2026-06-25T00:00:00.000+08:00",
    "generator": "knowledge-tree"
  },
  "schema": {
    "contentFormat": "block-doc-v1",
    "minAppVersion": "1.0.0"
  },
  "containers": [
    {
      "sourceId": "c_agent",
      "kind": "folder",
      "parentSourceId": null,
      "name": "Agent",
      "sort": 1
    },
    {
      "sourceId": "c_rag",
      "kind": "folder",
      "parentSourceId": null,
      "name": "RAG",
      "sort": 2
    }
  ],
  "entries": [
    {
      "sourceId": "e_react",
      "containerSourceId": "c_agent",
      "title": "ReAct",
      "summary": "按 Thought / Action / Observation 循环工作的 Agent 范式。",
      "tags": ["Agent", "推理范式"],
      "aliases": ["Reasoning and Acting"],
      "importance": "high",
      "difficulty": "basic",
      "doc": [
        {
          "type": "heading",
          "props": { "level": 3 },
          "content": "定义"
        },
        {
          "type": "paragraph",
          "content": "ReAct 让模型边推理边调用工具，再根据工具返回继续推理。"
        },
        {
          "type": "bulletListItem",
          "content": "Thought：判断下一步该做什么"
        },
        {
          "type": "bulletListItem",
          "content": "Action：选择并调用工具"
        },
        {
          "type": "bulletListItem",
          "content": "Observation：接收工具结果并继续循环"
        }
      ],
      "sourceRefs": [
        {
          "title": "ReAct Paper",
          "url": "https://arxiv.org/abs/2210.03629"
        }
      ]
    },
    {
      "sourceId": "e_multi_recall",
      "containerSourceId": "c_rag",
      "title": "多路召回",
      "summary": "并行用多种召回源再融合，提升召回率与鲁棒性。",
      "tags": ["RAG", "检索"],
      "importance": "medium",
      "difficulty": "intermediate",
      "intro": "多路召回通常会组合稠密、稀疏、规则、结构化数据和历史反馈。",
      "sourceRefs": [
        {
          "title": "RAG 参考",
          "url": "https://example.com/rag"
        }
      ]
    }
  ],
  "assets": [],
  "extensions": {}
}
